{
  "schema": "cubed-core/benchmark-v0-prediction",
  "schema_version": 1,
  "benchmark_id": "replaced-by-test-builder",
  "benchmark_version": "0",
  "capture_id": "00000000000000000000000000000000",
  "system": {
    "name": "synthetic-contract-system",
    "version": "0",
    "implementation_sha256": "ffffffffffffffffffffffffffffffffffffffffffffffffffffffffffffffff",
    "config_sha256": "eeeeeeeeeeeeeeeeeeeeeeeeeeeeeeeeeeeeeeeeeeeeeeeeeeeeeeeeeeeeeeee",
    "model_artifacts": [
      {
        "name": "synthetic-tracker",
        "sha256": "dddddddddddddddddddddddddddddddddddddddddddddddddddddddddddddddd"
      }
    ],
    "run_receipt_sha256": "cccccccccccccccccccccccccccccccccccccccccccccccccccccccccccccccc"
  },
  "inference": {
    "lane": "camera-only",
    "teacher_access": "none-declared",
    "teacher_artifacts_visible": false,
    "input_artifacts": []
  },
  "result": {
    "status": "abstained",
    "moves": [],
    "runtime_ms": 15,
    "abstention_reason": "synthetic-contract-abstention"
  },
  "component_metrics": []
}
